{
  "architecture_profile_ref": {
    "digest": "sha256:5005e709b88026dc67570fd1cc93560628ddaf251e76506c5d78f66090fa0804",
    "id": "six-layer-eventing",
    "version": "1"
  },
  "bindings": [
    {
      "binding_id": "binding.aws.aws.iot-core.resource_count",
      "compatibility_version": "1",
      "destination_input_id": "input.capacity.resource_count",
      "destination_selection_id": "selection.aws.aws.iot-core",
      "resolution_stage": "preplan",
      "sensitivity": "internal",
      "source_kind": "deployment_dimension",
      "source_ref": "dimension.aws.aws.iot-core.resource_count",
      "validator_id": "validator.non-negative-integer.v1",
      "value_type": "integer"
    },
    {
      "binding_id": "binding.aws.aws.iot-core.connected_devices",
      "compatibility_version": "1",
      "destination_input_id": "input.usage.connected_devices",
      "destination_selection_id": "selection.aws.aws.iot-core",
      "resolution_stage": "preplan",
      "sensitivity": "internal",
      "source_kind": "deployment_dimension",
      "source_ref": "dimension.aws.aws.iot-core.connected_devices",
      "validator_id": "validator.non-negative-integer.v1",
      "value_type": "integer"
    },
    {
      "binding_id": "binding.aws.aws.iot-core.messages",
      "compatibility_version": "1",
      "destination_input_id": "input.usage.messages",
      "destination_selection_id": "selection.aws.aws.iot-core",
      "resolution_stage": "preplan",
      "sensitivity": "internal",
      "source_kind": "deployment_dimension",
      "source_ref": "dimension.aws.aws.iot-core.messages",
      "validator_id": "validator.non-negative-integer.v1",
      "value_type": "integer"
    },
    {
      "binding_id": "binding.aws.aws.iot-commands.resource_count",
      "compatibility_version": "1",
      "destination_input_id": "input.capacity.resource_count",
      "destination_selection_id": "selection.aws.aws.iot-commands",
      "resolution_stage": "preplan",
      "sensitivity": "internal",
      "source_kind": "deployment_dimension",
      "source_ref": "dimension.aws.aws.iot-commands.resource_count",
      "validator_id": "validator.non-negative-integer.v1",
      "value_type": "integer"
    },
    {
      "binding_id": "binding.aws.aws.iot-commands.connected_devices",
      "compatibility_version": "1",
      "destination_input_id": "input.usage.connected_devices",
      "destination_selection_id": "selection.aws.aws.iot-commands",
      "resolution_stage": "preplan",
      "sensitivity": "internal",
      "source_kind": "deployment_dimension",
      "source_ref": "dimension.aws.aws.iot-commands.connected_devices",
      "validator_id": "validator.non-negative-integer.v1",
      "value_type": "integer"
    },
    {
      "binding_id": "binding.aws.aws.iot-commands.messages",
      "compatibility_version": "1",
      "destination_input_id": "input.usage.messages",
      "destination_selection_id": "selection.aws.aws.iot-commands",
      "resolution_stage": "preplan",
      "sensitivity": "internal",
      "source_kind": "deployment_dimension",
      "source_ref": "dimension.aws.aws.iot-commands.messages",
      "validator_id": "validator.non-negative-integer.v1",
      "value_type": "integer"
    },
    {
      "binding_id": "binding.azure.azure.functions-flex-consumption.resource_count",
      "compatibility_version": "1",
      "destination_input_id": "input.capacity.resource_count",
      "destination_selection_id": "selection.azure.azure.functions-flex-consumption",
      "resolution_stage": "preplan",
      "sensitivity": "internal",
      "source_kind": "deployment_dimension",
      "source_ref": "dimension.azure.azure.functions-flex-consumption.resource_count",
      "validator_id": "validator.non-negative-integer.v1",
      "value_type": "integer"
    },
    {
      "binding_id": "binding.azure.azure.functions-flex-consumption.requests",
      "compatibility_version": "1",
      "destination_input_id": "input.usage.requests",
      "destination_selection_id": "selection.azure.azure.functions-flex-consumption",
      "resolution_stage": "preplan",
      "sensitivity": "internal",
      "source_kind": "deployment_dimension",
      "source_ref": "dimension.azure.azure.functions-flex-consumption.requests",
      "validator_id": "validator.non-negative-integer.v1",
      "value_type": "integer"
    },
    {
      "binding_id": "binding.azure.azure.functions-flex-consumption.execution_seconds",
      "compatibility_version": "1",
      "destination_input_id": "input.usage.execution_seconds",
      "destination_selection_id": "selection.azure.azure.functions-flex-consumption",
      "resolution_stage": "preplan",
      "sensitivity": "internal",
      "source_kind": "deployment_dimension",
      "source_ref": "dimension.azure.azure.functions-flex-consumption.execution_seconds",
      "validator_id": "validator.non-negative-integer.v1",
      "value_type": "integer"
    },
    {
      "binding_id": "binding.azure.azure.logic-apps-consumption.resource_count",
      "compatibility_version": "1",
      "destination_input_id": "input.capacity.resource_count",
      "destination_selection_id": "selection.azure.azure.logic-apps-consumption",
      "resolution_stage": "preplan",
      "sensitivity": "internal",
      "source_kind": "deployment_dimension",
      "source_ref": "dimension.azure.azure.logic-apps-consumption.resource_count",
      "validator_id": "validator.non-negative-integer.v1",
      "value_type": "integer"
    },
    {
      "binding_id": "binding.azure.azure.logic-apps-consumption.workflow_executions",
      "compatibility_version": "1",
      "destination_input_id": "input.usage.workflow_executions",
      "destination_selection_id": "selection.azure.azure.logic-apps-consumption",
      "resolution_stage": "preplan",
      "sensitivity": "internal",
      "source_kind": "deployment_dimension",
      "source_ref": "dimension.azure.azure.logic-apps-consumption.workflow_executions",
      "validator_id": "validator.non-negative-integer.v1",
      "value_type": "integer"
    },
    {
      "binding_id": "binding.azure.azure.logic-apps-consumption.workflow_transitions",
      "compatibility_version": "1",
      "destination_input_id": "input.usage.workflow_transitions",
      "destination_selection_id": "selection.azure.azure.logic-apps-consumption",
      "resolution_stage": "preplan",
      "sensitivity": "internal",
      "source_kind": "deployment_dimension",
      "source_ref": "dimension.azure.azure.logic-apps-consumption.workflow_transitions",
      "validator_id": "validator.non-negative-integer.v1",
      "value_type": "integer"
    },
    {
      "binding_id": "binding.azure.azure.cosmos-db-nosql-raw-and-rollup.resource_count",
      "compatibility_version": "1",
      "destination_input_id": "input.capacity.resource_count",
      "destination_selection_id": "selection.azure.azure.cosmos-db-nosql-raw-and-rollup",
      "resolution_stage": "preplan",
      "sensitivity": "internal",
      "source_kind": "deployment_dimension",
      "source_ref": "dimension.azure.azure.cosmos-db-nosql-raw-and-rollup.resource_count",
      "validator_id": "validator.non-negative-integer.v1",
      "value_type": "integer"
    },
    {
      "binding_id": "binding.azure.azure.cosmos-db-nosql-raw-and-rollup.request_units",
      "compatibility_version": "1",
      "destination_input_id": "input.usage.request_units",
      "destination_selection_id": "selection.azure.azure.cosmos-db-nosql-raw-and-rollup",
      "resolution_stage": "preplan",
      "sensitivity": "internal",
      "source_kind": "deployment_dimension",
      "source_ref": "dimension.azure.azure.cosmos-db-nosql-raw-and-rollup.request_units",
      "validator_id": "validator.non-negative-integer.v1",
      "value_type": "integer"
    },
    {
      "binding_id": "binding.azure.azure.cosmos-db-nosql-raw-and-rollup.stored_gib_month",
      "compatibility_version": "1",
      "destination_input_id": "input.usage.stored_gib_month",
      "destination_selection_id": "selection.azure.azure.cosmos-db-nosql-raw-and-rollup",
      "resolution_stage": "preplan",
      "sensitivity": "internal",
      "source_kind": "deployment_dimension",
      "source_ref": "dimension.azure.azure.cosmos-db-nosql-raw-and-rollup.stored_gib_month",
      "validator_id": "validator.non-negative-decimal-string.v1",
      "value_type": "string"
    },
    {
      "binding_id": "binding.azure.azure.cosmos-db-nosql-raw-and-rollup.capacity_mode",
      "compatibility_version": "1",
      "destination_input_id": "input.deployable_selection.capacity_mode",
      "destination_selection_id": "selection.azure.azure.cosmos-db-nosql-raw-and-rollup",
      "resolution_stage": "preplan",
      "sensitivity": "internal",
      "source_kind": "deployment_dimension",
      "source_ref": "dimension.azure.azure.cosmos-db-nosql-raw-and-rollup.capacity_mode",
      "validator_id": "validator.capacity-mode.v1",
      "value_type": "string"
    },
    {
      "binding_id": "binding.azure.azure.cosmos-db-nosql-raw-and-rollup.autoscale_max_ru_per_second",
      "compatibility_version": "1",
      "destination_input_id": "input.capacity.autoscale_max_ru_per_second",
      "destination_selection_id": "selection.azure.azure.cosmos-db-nosql-raw-and-rollup",
      "resolution_stage": "preplan",
      "sensitivity": "internal",
      "source_kind": "deployment_dimension",
      "source_ref": "dimension.azure.azure.cosmos-db-nosql-raw-and-rollup.autoscale_max_ru_per_second",
      "validator_id": "validator.non-negative-integer.v1",
      "value_type": "integer"
    },
    {
      "binding_id": "binding.azure.azure.blob-cool.resource_count",
      "compatibility_version": "1",
      "destination_input_id": "input.capacity.resource_count",
      "destination_selection_id": "selection.azure.azure.blob-cool",
      "resolution_stage": "preplan",
      "sensitivity": "internal",
      "source_kind": "deployment_dimension",